{
  "trama": "template",
  "versao": 1,
  "nome": "Anisotropia, validacao cruzada e krigagem universal",
  "descricao": "Variograma em quatro direcoes com faixa de referencia sob isotropia, ajuste com anisotropia geometrica, validacao cruzada do modelo e krigagem universal com tendencia de 1a ordem.",
  "colecoes": ["trama.spatial"],
  "doc": {
    "format": 1,
    "rev": 15,
    "collections": {
      "spatial": "0.2.0"
    },
    "nodes": {
      "pontos": {
        "type": "spatial/example",
        "type_version": 1,
        "label": "Exemplo espacial",
        "params": {
          "dataset": "milho_pr"
        },
        "seed": 259502235
      },
      "aniso": {
        "type": "spatial/anisotropy",
        "type_version": 1,
        "label": "Anisotropia",
        "params": {
          "direcoes": "0,45,90,135",
          "envelope": true,
          "n_sim": 19,
          "semente": 42
        },
        "seed": 32185314
      },
      "variograma": {
        "type": "spatial/variogram",
        "type_version": 1,
        "label": "Variograma",
        "params": {
          "tendencia": "1a ordem"
        },
        "seed": 247942073
      },
      "ajuste": {
        "type": "spatial/variogram_fit",
        "type_version": 1,
        "label": "Ajustar modelo",
        "params": {
          "familia": "esferico",
          "razao": 2,
          "angulo": 45
        },
        "seed": 140023745
      },
      "validacao": {
        "type": "spatial/validation",
        "type_version": 1,
        "label": "Validação cruzada",
        "params": {
          "metodo": "leave-one-out"
        },
        "seed": 150155349
      },
      "krigagem": {
        "type": "spatial/kriging",
        "type_version": 1,
        "label": "Krigagem",
        "params": {
          "tipo": "universal",
          "tendencia": "1a ordem"
        },
        "seed": 264400552
      },
      "mapa_erro": {
        "type": "spatial/map",
        "type_version": 1,
        "label": "Mapa da superfície",
        "params": {
          "mostrar": "erro-padrao"
        },
        "seed": 73014793
      }
    },
    "edges": [
      {
        "from": {
          "node": "pontos",
          "port": "out"
        },
        "to": {
          "node": "aniso",
          "port": "pontos"
        },
        "index": 1
      },
      {
        "from": {
          "node": "pontos",
          "port": "out"
        },
        "to": {
          "node": "variograma",
          "port": "pontos"
        },
        "index": 1
      },
      {
        "from": {
          "node": "variograma",
          "port": "out"
        },
        "to": {
          "node": "ajuste",
          "port": "variograma"
        },
        "index": 1
      },
      {
        "from": {
          "node": "pontos",
          "port": "out"
        },
        "to": {
          "node": "validacao",
          "port": "pontos"
        },
        "index": 1
      },
      {
        "from": {
          "node": "ajuste",
          "port": "out"
        },
        "to": {
          "node": "validacao",
          "port": "modelo"
        },
        "index": 1
      },
      {
        "from": {
          "node": "pontos",
          "port": "out"
        },
        "to": {
          "node": "krigagem",
          "port": "pontos"
        },
        "index": 1
      },
      {
        "from": {
          "node": "ajuste",
          "port": "out"
        },
        "to": {
          "node": "krigagem",
          "port": "modelo"
        },
        "index": 1
      },
      {
        "from": {
          "node": "krigagem",
          "port": "out"
        },
        "to": {
          "node": "mapa_erro",
          "port": "superficie"
        },
        "index": 1
      }
    ],
    "ui": {
      "positions": {
        "pontos": [0, 0],
        "aniso": [360, 0],
        "variograma": [360, 628],
        "ajuste": [720, 628],
        "validacao": [1080, 0],
        "krigagem": [1080, 628],
        "mapa_erro": [1440, 628]
      },
      "sizes": {},
      "views": {},
      "frames": {},
      "modes": {},
      "saidas": {},
      "soltos": {},
      "notes": {},
      "ocultos": {},
      "grupos": {},
      "galeria": {},
      "ramos": {}
    }
  }
}
