{
  "trama": "template",
  "versao": 1,
  "nome": "Classificação com floresta aleatória",
  "descricao": "Espécie de iris prevista por floresta aleatória: separa treino e teste, avalia e mostra a matriz de confusão.",
  "colecoes": ["trama.ml", "trama.models"],
  "doc": {
    "format": 1,
    "rev": 13,
    "collections": {
      "ml": "0.5.0",
      "models": "0.4.0"
    },
    "nodes": {
      "dados": {
        "type": "ml/example",
        "type_version": 1,
        "label": "Dados para aprender",
        "params": {
          "nome": "iris"
        },
        "seed": 135350314
      },
      "separar": {
        "type": "ml/split",
        "type_version": 3,
        "label": "Separar treino / teste",
        "params": {
          "resposta": "Species",
          "seed": 42
        },
        "seed": 150228636
      },
      "floresta": {
        "type": "ml/forest",
        "type_version": 3,
        "label": "Random forest",
        "params": {
          "resposta": "Species",
          "trees": 200
        },
        "seed": 198606431
      },
      "prever": {
        "type": "models/predict",
        "type_version": 1,
        "label": "Prever",
        "params": {},
        "seed": 10903832
      },
      "avaliar": {
        "type": "models/evaluate",
        "type_version": 3,
        "label": "Avaliar previsões",
        "params": {
          "resposta": "Species"
        },
        "seed": 129449846
      },
      "confusao": {
        "type": "models/confusion",
        "type_version": 2,
        "label": "Matriz de confusão",
        "params": {
          "resposta": "Species"
        },
        "seed": 223421417
      }
    },
    "edges": [
      {
        "from": {
          "node": "dados",
          "port": "out"
        },
        "to": {
          "node": "separar",
          "port": "dados"
        },
        "index": 1
      },
      {
        "from": {
          "node": "separar",
          "port": "treino"
        },
        "to": {
          "node": "floresta",
          "port": "dados"
        },
        "index": 1
      },
      {
        "from": {
          "node": "floresta",
          "port": "out"
        },
        "to": {
          "node": "prever",
          "port": "modelo"
        },
        "index": 1
      },
      {
        "from": {
          "node": "separar",
          "port": "teste"
        },
        "to": {
          "node": "prever",
          "port": "dados"
        },
        "index": 1
      },
      {
        "from": {
          "node": "prever",
          "port": "out"
        },
        "to": {
          "node": "avaliar",
          "port": "dados"
        },
        "index": 1
      },
      {
        "from": {
          "node": "prever",
          "port": "out"
        },
        "to": {
          "node": "confusao",
          "port": "dados"
        },
        "index": 1
      }
    ],
    "ui": {
      "positions": {
        "dados": [0, 0],
        "separar": [360, 0],
        "floresta": [720, 0],
        "prever": [1080, 0],
        "avaliar": [1440, 0],
        "confusao": [1440, 598]
      },
      "sizes": {},
      "views": {},
      "frames": {},
      "modes": {},
      "saidas": {},
      "soltos": {},
      "notes": {},
      "ocultos": {},
      "grupos": {},
      "galeria": {},
      "ramos": {}
    }
  }
}
